"variable","varsymbol","pricesymbol"
"305","rev-from aboriginal general governments-local general governments-3800080","",""
"306","rev-investment income-local general governments-3800080","",""
"307","rev-interest and other investment income-local general governments-3800080","",""
"308","rev-remitted profits of government business enterprises-local general governments-3800080","",""
"309","rev-sales of goods and services-local general governments-3800080","",""
"310","rev-capital transfers-local general governments-3800080","",""
"311","rev-cap transfer-from households-local general governments-3800080","",""
"312","rev-cap transfer-from non-profit institutions serving households-local general governments-3800080","",""
"313","rev-cap transfer-from business-local general governments-3800080","",""
"314","rev-cap transfer-from general governments-local general governments-3800080","",""
"315","rev-cap transfer-from federal general government-local general governments-3800080","",""
"316","rev-cap transfer-from provincial and territorial general governments-local general governments-3800080","",""
"317","rev-cap transfer-from provincial administration-local general governments-3800080","",""
"318","rev-cap transfer-from provincial education-local general governments-3800080","",""
"319","rev-cap transfer-from provincial health and social services-local general governments-3800080","",""
"320","rev-cap transfer-from aboriginal general governments-local general governments-3800080","",""
"321","exp-general governments expenditure-local general governments-3800080","",""
"322","exp-final expenditure on goods and services-local general governments-3800080","",""
"323","exp-municipalities-local general governments-3800080","",""
"324","exp-schools-local general governments-3800080","",""
"325","exp-current transfers to households-local general governments-3800080","",""
"326","exp-social assistance-local general governments-3800080","",""
"327","exp-other current transfers to households-local general governments-3800080","",""
"328","exp-current transfers to non-profit institutions serving households-local general governments-3800080","",""
"329","exp-subsidies-local general governments-3800080","",""
"330","exp-subsidies on products and imports-local general governments-3800080","",""
"331","exp-subsidies on production-local general governments-3800080","",""
"332","exp-current transfers to general governments-local general governments-3800080","",""
"333","exp-to federal general government-local general governments-3800080","",""
"334","exp-to provincial and territorial general governments-local general governments-3800080","",""
"335","exp-to provincial and territorial administration-local general governments-3800080","",""
"336","exp-to provincial and territorial education-local general governments-3800080","",""
"337","exp-to provincial health and social services-local general governments-3800080","",""
"338","exp-to aboriginal general governments-local general governments-3800080","",""
"339","exp-current transfers to non-residents-local general governments-3800080","",""
"340","exp-capital transfers-local general governments-3800080","",""
"341","exp-cap transfer-to households-local general governments-3800080","",""
"342","exp-cap transfer-to non-profit institutions serving households-local general governments-3800080","",""
"343","exp-cap transfer-to business-local general governments-3800080","",""
"344","exp-cap transfer-to general governments-local general governments-3800080","",""
"345","exp-cap transfer-to federal general government-local general governments-3800080","",""
"346","exp-cap transfer-to provincial and territorial general governments-local general governments-3800080","",""
"347","exp-cap transfer-to provincial administration-local general governments-3800080","",""
"348","exp-cap transfer-to provincial education-local general governments-3800080","",""
"349","exp-cap transfer-to provincial health and social services-local general governments-3800080","",""
"350","exp-cap transfer-to aboriginal general governments-local general governments-3800080","",""
"351","exp-cap transfer-to non-residents-local general governments-3800080","",""
"352","exp-interest on debt-local general governments-3800080","",""
"353","exp-general governments surplus or deficit-local general governments-3800080","",""
"354","exp-plus: consumption of fixed capital-local general governments-3800080","",""
"355","exp-less: non-financial capital acquisition-local general governments-3800080","",""
"356","exp-fixed capital-local general governments-3800080","",""
"357","exp-new capital-local general governments-3800080","",""
"358","exp-existing capital-local general governments-3800080","",""
"359","exp-equals: net lending or net borrowing-local general governments-3800080","",""
"360","rev-general governments revenue-aboriginal general governments-3800080","",""
"361","rev-taxes on incomes-aboriginal general governments-3800080","",""
"362","rev-tax-from households-aboriginal general governments-3800080","",""
"363","rev-income taxes-aboriginal general governments-3800080","",""
"364","rev-wealth transfer taxes-aboriginal general governments-3800080","",""
"365","rev-from corporations and government business enterprises-aboriginal general governments-3800080","",""
"366","rev-contributions to social insurance plans-aboriginal general governments-3800080","",""
"367","rev-taxes on production and imports-aboriginal general governments-3800080","",""
"368","rev-taxes on production-aboriginal general governments-3800080","",""
"369","rev-taxes on products-aboriginal general governments-3800080","",""
"370","rev-other current transfers from households-aboriginal general governments-3800080","",""
"371","rev-current transfers from non-profit institutions serving households-aboriginal general governments-3800080","",""
"372","rev-current transfers from general governments-aboriginal general governments-3800080","",""
"373","rev-from federal general government-aboriginal general governments-3800080","",""
"374","rev-from provincial and territorial general governments-aboriginal general governments-3800080","",""
"375","rev-from local general governments-aboriginal general governments-3800080","",""
"376","rev-investment income-aboriginal general governments-3800080","",""
"377","rev-sales of goods and services-aboriginal general governments-3800080","",""
"378","rev-capital transfers-aboriginal general governments-3800080","",""
"379","rev-cap transfer-from households-aboriginal general governments-3800080","",""
"380","rev-cap transfer-from non-profit institutions serving households-aboriginal general governments-3800080","",""
"381","rev-cap transfer-from business-aboriginal general governments-3800080","",""
"382","rev-cap transfer-from general governments-aboriginal general governments-3800080","",""
"383","rev-cap transfer-from federal general government-aboriginal general governments-3800080","",""
"384","rev-cap transfer-from provincial and territorial general governments-aboriginal general governments-3800080","",""
"385","rev-cap transfer-from local general governments-aboriginal general governments-3800080","",""
"386","exp-general governments expenditure-aboriginal general governments-3800080","",""
"387","exp-final expenditure on goods and services-aboriginal general governments-3800080","",""
"388","exp-current transfers to households-aboriginal general governments-3800080","",""
"389","exp-current transfers to non-profit institutions serving households-aboriginal general governments-3800080","",""
"390","exp-subsidies-aboriginal general governments-3800080","",""
"391","exp-subsidies on products and imports-aboriginal general governments-3800080","",""
"392","exp-subsidies on production-aboriginal general governments-3800080","",""
"393","exp-current transfers to general governments-aboriginal general governments-3800080","",""
"394","exp-to federal general government-aboriginal general governments-3800080","",""
"395","exp-to provincial and territorial general governments-aboriginal general governments-3800080","",""
"396","exp-to local general governments-aboriginal general governments-3800080","",""
"397","exp-current transfers to non-residents-aboriginal general governments-3800080","",""
"398","exp-capital transfers-aboriginal general governments-3800080","",""
"399","exp-cap transfer-to households-aboriginal general governments-3800080","",""
"400","exp-cap transfer-to non-profit institutions serving households-aboriginal general governments-3800080","",""
"401","exp-cap transfer-to business-aboriginal general governments-3800080","",""
"402","exp-cap transfer-to general governments-aboriginal general governments-3800080","",""
"403","exp-cap transfer-to federal general government-aboriginal general governments-3800080","",""
"404","exp-cap transfer-to provincial and territorial general governments-aboriginal general governments-3800080","",""
"405","exp-cap transfer-to local general governments-aboriginal general governments-3800080","",""
"406","exp-cap transfer-to non-residents-aboriginal general governments-3800080","",""
"407","exp-interest on debt-aboriginal general governments-3800080","",""
"408","exp-general governments surplus or deficit-aboriginal general governments-3800080","",""
"409","exp-plus: consumption of fixed capital-aboriginal general governments-3800080","",""
"410","exp-less: non-financial capital acquisition-aboriginal general governments-3800080","",""
"411","exp-fixed capital-aboriginal general governments-3800080","",""
"412","exp-new capital-aboriginal general governments-3800080","",""
"413","exp-existing capital-aboriginal general governments-3800080","",""
"414","exp-equals: net lending or net borrowing-aboriginal general governments-3800080","",""
"415","rev-general governments revenue-canada pension plan-3800080","",""
"416","rev-contributions to social insurance plans-canada pension plan-3800080","",""
"417","rev-investment income-canada pension plan-3800080","",""
"418","exp-general governments expenditure-canada pension plan-3800080","",""
"419","exp-final expenditure on goods and services-canada pension plan-3800080","",""
"420","exp-current transfers to households-canada pension plan-3800080","",""
"421","exp-current transfers to non-residents-canada pension plan-3800080","",""
"422","exp-general governments surplus or deficit-canada pension plan-3800080","",""
"423","rev-general governments revenue-quebec pension plan-3800080","",""
"424","rev-contributions to social insurance plans-quebec pension plan-3800080","",""
"425","rev-investment income-quebec pension plan-3800080","",""
"426","exp-general governments expenditure-quebec pension plan-3800080","",""
"427","exp-final expenditure on goods and services-quebec pension plan-3800080","",""
"428","exp-current transfers to households-quebec pension plan-3800080","",""
"429","exp-general governments surplus or deficit-quebec pension plan-3800080","",""
"430","exp-to provincial health and social services-federal general government-3800080","",""
"431","gross domestic product (gdp) at basic prices-3790031-chained (2012) dollars","",""
"432","service-producing industries-gross domestic product (gdp) at basic prices-3790031-chained (2012) dollars","",""
"433","industrial production-gross domestic product (gdp) at basic prices-3790031-chained (2012) dollars","",""
"434","gross domestic product (gdp) at basic prices-3790031-2012 constant prices","",""
"435","industrial product price index-3290077","",""
"436","rev-sales taxes-federal general government-3800080","",""
"437","exp-military veterans' benefits-federal general government-3800080","",""
"438","exp-inventories-provincial and territorial general governments-3800080","",""
"439","exp-agricultural insurance premiums-local general governments-3800080","",""
"440","rev-excise taxes-local general governments-3800080","",""
"441","exp-meals and hotels taxes-local general governments-3800080","",""
"442","exp-other excise taxes-local general governments-3800080","",""
"443","exp-inventories-local general governments-3800080","",""
"444","exp-inventories-aboriginal general governments-3800080","",""
"445","exp-interest on debt-canada pension plan-3800080","",""
"446","retail services price index-3320024","",""
"447","electric power selling price index-electric power selling price over 5000kw-3290079","PELEC_COM",""
"448","electric power selling price index-electric power selling price under 5000kw-3290079","PELEC_RES",""
"449","wholesale services price index-3320029","",""
"450","exp-canada child benefit-federal general government-3800080","",""
"451","new housing price index-total (house and land)-3270056","PH",""
"452","prime corporate paper rate: 3 month-1760043","RSH",""
"453","chartered bank administered interest rates - prime rate-1760043","",""
"454","chartered bank - consumer loan rate-1760043","RCON",""
"455","selected government of canada benchmark bond yields: 10 years-1760043","RLG",""
"456","chartered banks-non-mortgage loans, call and other short loans to investment dealers and brokers-1760074","",""
"457","chartered banks-non-mortgage loans, to canadian federal government, provinces, municipalities, or school corporations-1760074","",""
"458","chartered banks-non-mortgage loans, to individuals for non-business purposes, total personal loans-1760074","LNPE",""
"459","chartered banks-non-mortgage loans, to individuals and others for business purposes, total loans to canadian resident non-financial business-1760074","",""
"460","wholesale trade-0810012","",""
"461","value of inventory change-0020009","",""
"462","population estimates on july 1st-65 years and over-0510001","POP65",""
"463","population estimates on july 1st-15 to 19 years-0510001","POP1519",""
"464","population estimates on july 1st-60 to 64 years-0510001","POP6064",""
"465","population estimates on july 1st-0 to 14 years-0510001","POP14",""
"466","population estimates on july 1st-15 to 64 years-0510001","POP1564",""
"467","capital and repair expenditures-capital expenditures-0290009","",""
"468","capital and repair expenditures-capital, construction-0290009","",""
"469","capital and repair expenditures-capital, machinery and equipment-0290009","",""
"470","investment-total assets-0310002-current prices","",""
"471","investment-building-0310002-current prices","",""
"472","investment-engineering-0310002-current prices","",""
"473","investment-machinery and equipment-0310002-current prices","",""
"474","geometric (infinite) depreciation-total assets-0310002-current prices","",""
"475","geometric (infinite) depreciation-building-0310002-current prices","",""
"476","geometric (infinite) depreciation-engineering-0310002-current prices","",""
"477","geometric (infinite) depreciation-machinery and equipment-0310002-current prices","",""
"478","geometric (infinite) end-year net stock-total assets-0310002-current prices","",""
"479","geometric (infinite) end-year net stock-building-0310002-current prices","",""
"480","geometric (infinite) end-year net stock-engineering-0310002-current prices","",""
"481","geometric (infinite) end-year net stock-machinery and equipment-0310002-current prices","",""
"482","gross domestic product (gdp) at basic prices-3790017-1997 constant dollars","",""
"483","gross domestic product (gdp) at basic prices-3790025-current prices","",""
"484","gross domestic product (gdp) at basic prices-3790025-1997 constant dollars","",""
"485","gross domestic product (gdp) at basic price in current dollars-total economy-3790023-current prices","",""
"486","investment-total assets-0310002-chained (2007) dollars","",""
"487","investment-building-0310002-chained (2007) dollars","",""
"488","investment-engineering-0310002-chained (2007) dollars","",""
"489","investment-machinery and equipment-0310002-chained (2007) dollars","",""
"490","geometric (infinite) depreciation-total assets-0310002-chained (2007) dollars","",""
"491","geometric (infinite) depreciation-building-0310002-chained (2007) dollars","",""
"492","geometric (infinite) depreciation-engineering-0310002-chained (2007) dollars","",""
"493","geometric (infinite) depreciation-machinery and equipment-0310002-chained (2007) dollars","",""
"494","geometric (infinite) end-year net stock-total assets-0310002-chained (2007) dollars","",""
"495","geometric (infinite) end-year net stock-building-0310002-chained (2007) dollars","",""
"496","geometric (infinite) end-year net stock-engineering-0310002-chained (2007) dollars","",""
"497","geometric (infinite) end-year net stock-machinery and equipment-0310002-chained (2007) dollars","",""
"498","total salaries and wages-3010006","",""
"499","cost of materials and supplies-3010006","",""
"500","total opening inventories-3010006","",""
"501","total closing inventories-3010006","",""
"502","total number of employees-3010006","",""
"503","total cost of energy-3010006","",""
"504","manufacturing value added-3010006","",""
"505","provincial gross output at basic prices in current dollars-3810016-current prices","",""
"506","gross domestic product (gdp) at basic prices-3790025-chained (2002) dollars","",""
"507","opening inventory-total all stores-0800023","",""
"508","closing inventory-total all stores-0800023","",""
"509","goods purchased for resale-goods purchased for resale, opening inventory-0810014","",""
"510","goods purchased for resale-goods purchased for resale, closing inventory-0810014","",""
"511","gross domestic product (gdp) at basic prices-3790030-current prices","",""
"512","service-producing industries-gross domestic product (gdp) at basic prices-3790030-current prices","",""
"513","industrial production-gross domestic product (gdp) at basic prices-3790030-current prices","",""
"514","gross domestic product (gdp) at basic prices-3790030-chained (2012) dollars","",""
"515","service-producing industries-gross domestic product (gdp) at basic prices-3790030-chained (2012) dollars","",""
"516","industrial production-gross domestic product (gdp) at basic prices-3790030-chained (2012) dollars","",""
"517","gross operating surplus-3840037","COGTP",""
"518","taxes less subsidies on products and imports-3840037","NETSUB",""
"519","statistical discrepancy-3840037","",""
"520","compensation of employees-3840040","PEWFP",""
"521","plus: net mixed income-3840040","PENIR",""
"522","non-farm-3840040","",""
"523","farm-3840040","",""
"524","rental income of households-3840040","",""
"525","plus: net property income-3840040","",""
"526","property income received-3840040","PEDIR",""
"527","less: property income paid-3840040","PEDIP",""
"528","equals: primary household income-3840040","",""
"529","primary household income-3840040","",""
"530","plus: current transfers received-3840040","",""
"531","from non-profit institutions serving households-3840040","",""
"532","from corporations-3840040","",""
"533","from general governments-3840040","GCGPE",""
"534","employment insurance benefits-3840040","",""
"535","social security benefits-3840040","",""
"536","other benefits-3840040","",""
"537","from non-residents-3840040","",""
"538","less: current transfers paid-3840040","",""
"539","to non-profit institutions serving households-3840040","",""
"540","to corporations-3840040","",""
"541","to general governments-3840040","",""
"542","personal income tax-3840040","",""
"543","other current transfers-3840040","",""
"544","of which: contributions to social insurance plans-3840040","",""
"545","to non-residents-3840040","",""
"546","equals: household disposable income-3840040","",""
"547","household disposable income-3840040","PEDY!",""
"548","less: household final consumption expenditure-3840040","",""
"549","equals: household net saving-3840040","PESV",""
"550","household saving rate-3840040","PESR",""
"551","final consumption expenditure-3840038-chained (2012) dollars","",""
"552","household final consumption expenditure-3840038-chained (2012) dollars","C",""
"553","goods-3840038-chained (2012) dollars","",""
"554","durable goods-3840038-chained (2012) dollars","CD",""
"555","semi-durable goods-3840038-chained (2012) dollars","",""
"556","non-durable goods-3840038-chained (2012) dollars","CND",""
"557","services-3840038-chained (2012) dollars","CS",""
"558","non-profit institutions serving households' final consumption expenditure-3840038-chained (2012) dollars","C_NPISH",""
"559","general governments final consumption expenditure-3840038-chained (2012) dollars","GC",""
"560","gross fixed capital formation-3840038-chained (2012) dollars","",""
"561","business gross fixed capital formation-3840038-chained (2012) dollars","IPNR_BUS",""
"562","residential structures-3840038-chained (2012) dollars","IPRD",""
"563","non-residential structures, machinery and equipment-3840038-chained (2012) dollars","",""
"564","non-residential structures-3840038-chained (2012) dollars","IPNRCON",""
"565","machinery and equipment-3840038-chained (2012) dollars","IPNRME",""
"566","intellectual property products-3840038-chained (2012) dollars","IPNRIP",""
"567","non-profit institutions serving households' gross fixed capital formation-3840038-chained (2012) dollars","",""
"568","general governments gross fixed capital formation-3840038-chained (2012) dollars","GI",""
"569","investment in inventories-3840038-chained (2012) dollars","IS",""
"570","of which: business investment in inventories-3840038-chained (2012) dollars","",""
"571","non-farm-3840038-chained (2012) dollars","",""
"572","farm-3840038-chained (2012) dollars","",""
"573","exports to other countries-3840038-chained (2012) dollars","XX",""
"574","imports from other countries-3840038-chained (2012) dollars","MX",""
"575","statistical discrepancy-3840038-chained (2012) dollars","",""
"576","gross domestic product at market prices-3840038-chained (2012) dollars","GDP",""
"577","final domestic demand-3840038-chained (2012) dollars","DOMD",""
"578","final consumption expenditure-3840038-current prices","",""
"579","household final consumption expenditure-3840038-current prices","C","!"
"580","goods-3840038-current prices","",""
"581","durable goods-3840038-current prices","CD","!"
"582","semi-durable goods-3840038-current prices","",""
"583","non-durable goods-3840038-current prices","CND","!"
"584","services-3840038-current prices","CS","!"
"585","non-profit institutions serving households' final consumption expenditure-3840038-current prices","C!_NPISH",""
"586","general governments final consumption expenditure-3840038-current prices","GC","!"
"587","gross fixed capital formation-3840038-current prices","",""
"588","business gross fixed capital formation-3840038-current prices","IPNR_BUS","!"
"589","residential structures-3840038-current prices","IPRD","!"
"590","non-residential structures, machinery and equipment-3840038-current prices","",""
"591","non-residential structures-3840038-current prices","IPNRCON","!"
"592","machinery and equipment-3840038-current prices","IPNRME","!"
"593","intellectual property products-3840038-current prices","IPNRIP","!"
"594","non-profit institutions serving households' gross fixed capital formation-3840038-current prices","",""
"595","general governments gross fixed capital formation-3840038-current prices","GI","!"
"596","investment in inventories-3840038-current prices","IS","!"
"597","of which: business investment in inventories-3840038-current prices","",""
"598","non-farm-3840038-current prices","",""
"599","farm-3840038-current prices","",""
"600","exports of goods and services-3840038-current prices","X","!"
"601","exports to other countries-3840038-current prices","XX","!"
"602","exports to other provinces-3840038-current prices","XN","!"
"603","exports of goods to other provinces-3840038-current prices","XGN","!"
"604","exports of services to other provinces-3840038-current prices","XSN","!"
"605","less: imports of goods and services-3840038-current prices","M","!"
"606","imports from other countries-3840038-current prices","MX","!"
"607","imports from other provinces-3840038-current prices","MN","!"
"608","imports of goods from other provinces-3840038-current prices","MGN","!"
"609","imports of services from other provinces-3840038-current prices","MSN","!"
"610","statistical discrepancy-3840038-current prices","SD","!"
"611","gross domestic product at market prices-3840038-current prices","GDP","!"
"612","final domestic demand-3840038-current prices","DOMD","!"
"613","exports of goods and services-3840038-chained (2012) dollars","X",""
"614","exports of goods to other countries-3840038-chained (2012) dollars","XGX","!"
"615","exports of services to other countries-3840038-chained (2012) dollars","XSX",""
"616","exports to other provinces-3840038-chained (2012) dollars","XN",""
"617","exports of goods to other provinces-3840038-chained (2012) dollars","XGN",""
"618","exports of services to other provinces-3840038-chained (2012) dollars","XSN",""
"619","less: imports of goods and services-3840038-chained (2012) dollars","M",""
"620","imports of goods from other countries-3840038-chained (2012) dollars","MGX",""
"621","imports of services from other countries-3840038-chained (2012) dollars","MSX",""
"622","imports from other provinces-3840038-chained (2012) dollars","MN",""
"623","imports of goods from other provinces-3840038-chained (2012) dollars","MGN",""
"624","imports of services from other provinces-3840038-chained (2012) dollars","MSN",""
"625","exports of goods to other countries-3840038-current prices","XGX","!"
"626","exports of services to other countries-3840038-current prices","XSX","!"
"627","imports of goods from other countries-3840038-current prices","MGX","!"
"628","imports of services from other countries-3840038-current prices","MSX","!"
"629","household final consumption expenditure-implicit price indexes-3840039","PC",""
