"variable","varsymbol","pricesymbol"
"1","employment","EMP",""
"2","gross output (x 1,000,000)","GY","!"
"3","investment - current prices (x 1,000,000)","IF","!"
"4","investment, constr - current prices (x 1,000,000)","IFC","!"
"5","investment, ip - current prices (x 1,000,000)","IFIP","!"
"6","investment, mach - current prices (x 1,000,000)","IFME","!"
"7","price index","P",""
"8","capital depreciation - chained prices (x 1,000,000)","",""
"9","capital stock - chained prices (x 1,000,000)","K",""
"10","depreciation, constr - chained prices (x 1,000,000)","DELTAC",""
"11","depreciation, ip - chained prices (x 1,000,000)","DELTAIP",""
"12","depreciation, mach - chained prices (x 1,000,000)","DELTAME",""
"13","gross output - constant prices (x 1,000,000)","GY",""
"14","gva - chained prices (x 1,000,000)","Y",""
"15","gva - current prices (x 1,000,000)","Y","!"
"16","investment - chained prices (x 1,000,000)","IF",""
"17","investment, constr - chained prices (x 1,000,000)","IFC",""
"18","investment, ip - chained prices (x 1,000,000)","IFIP",""
"19","investment, mach - chained prices (x 1,000,000)","IFME",""
"20","stock, constr - chained prices (x 1,000,000)","KC",""
"21","stock, ip - chained prices (x 1,000,000)","KIP",""
"22","stock, mach - chained prices (x 1,000,000)","KME",""
"23","wages","ER",""
"24","crude oil and equivalent-total crude production-1260001","OIL",""
"25","crude oil and equivalent-total exports-1260001","XOIL",""
"26","crude oil and equivalent-imports-1260001","MOIL",""
"27","building permits-0260006","HPT",""
"28","housing starts-0270008","HSTART",""
"29","housing completions-0270008","HCOMP",""
"30","sales of goods manufactured (shipments)-3040014","MANSHIP",""
"31","sales of goods manufactured (shipments)-3040015","MANSHIP",""
"32","wages-wages and salaries-3820006","",""
"33","immigrants-0510037","MIGIN",""
"34","emigrants-0510037","MIGOUT",""
"35","estimates of interprovincial migrants by province or territory of origin and destination-prince edward island, province of destination-0510045","POPMIG_PE",""
"36","estimates of interprovincial migrants by province or territory of origin and destination-nova scotia, province of destination-0510045","POPMIG_NS",""
"37","estimates of interprovincial migrants by province or territory of origin and destination-new brunswick, province of destination-0510045","POPMIG_NB",""
"38","estimates of interprovincial migrants by province or territory of origin and destination-quebec, province of destination-0510045","POPMIG_QC",""
"39","estimates of interprovincial migrants by province or territory of origin and destination-ontario, province of destination-0510045","POPMIG_ON",""
"40","estimates of interprovincial migrants by province or territory of origin and destination-manitoba, province of destination-0510045","POPMIG_MA",""
"41","estimates of interprovincial migrants by province or territory of origin and destination-saskatchewan, province of destination-0510045","POPMIG_SK",""
"42","estimates of interprovincial migrants by province or territory of origin and destination-alberta, province of destination-0510045","POPMIG_AB",""
"43","estimates of interprovincial migrants by province or territory of origin and destination-british columbia, province of destination-0510045","POPMIG_BC",""
"44","estimates of interprovincial migrants by province or territory of origin and destination-yukon, province of destination-0510045","POPMIG_YK",""
"45","estimates of interprovincial migrants by province or territory of origin and destination-northwest territories, province of destination-0510045","POPMIG_NT",""
"46","estimates of interprovincial migrants by province or territory of origin and destination-nunavut, province of destination-0510045","POPMIG_NU",""
"47","estimates of interprovincial migrants by province or territory of origin and destination-newfoundland and labrador, province of destination-0510045","POPMIG_NL",""
"48","exports of goods-3800064-current prices","XG!",""
"49","exports of services-3800064-current prices","XS!",""
"50","imports of goods-3800064-current prices","MG!",""
"51","imports of services-3800064-current prices","MS!",""
"52","population estimates-0510005","POP",""
"53","labour force-15 years and over-2820087","",""
"54","unemployment-15 years and over-2820087","",""
"55","unemployment rate-15 years and over-2820087","",""
"56","participation rate-15 years and over-2820087","",""
"57","population-15 to 64 years-2820001","",""
"58","unemployment rate-15 to 64 years-2820087","",""
"59","couriers and messengers services price index-3290053","",""
"60","consumer price index-all-items-3260020","CPI",""
"61","consumer price index-all-items excluding food and energy-3260020","CPICORE",""
"62","consumer price index-all-items excluding energy-3260020","CPIX",""
"63","consumer price index-energy-3260020","CPIE",""
"64","rev-general governments revenue-general governments-3800080","",""
"65","rev-taxes on incomes-general governments-3800080","",""
"66","rev-tax-from households-general governments-3800080","",""
"67","rev-income taxes-general governments-3800080","",""
"68","rev-wealth transfer taxes-general governments-3800080","",""
"69","rev-from corporations and government business enterprises-general governments-3800080","",""
"70","rev-from non-residents (withholding taxes)-general governments-3800080","",""
"71","rev-contributions to social insurance plans-general governments-3800080","",""
"72","rev-taxes on production and imports-general governments-3800080","",""
"73","rev-taxes on production-general governments-3800080","",""
"74","rev-taxes on products-general governments-3800080","",""
"75","rev-other current transfers from households-general governments-3800080","",""
"76","rev-current transfers from non-profit institutions serving households-general governments-3800080","",""
"77","rev-other current transfers from non-residents-general governments-3800080","",""
"78","rev-investment income-general governments-3800080","",""
"79","rev-sales of goods and services-general governments-3800080","",""
"80","rev-capital transfers-general governments-3800080","",""
"81","rev-cap transfer-from households-general governments-3800080","",""
"82","rev-cap transfer-from non-profit institutions serving households-general governments-3800080","",""
"83","rev-cap transfer-from business-general governments-3800080","",""
"84","rev-cap transfer-from non-residents-general governments-3800080","",""
"85","exp-general governments expenditure-general governments-3800080","",""
"86","exp-final expenditure on goods and services-general governments-3800080","",""
"87","exp-current transfers to households-general governments-3800080","",""
"88","exp-current transfers to non-profit institutions serving households-general governments-3800080","",""
"89","exp-subsidies-general governments-3800080","",""
"90","exp-subsidies on products and imports-general governments-3800080","",""
"91","exp-subsidies on production-general governments-3800080","",""
"92","exp-current transfers to non-residents-general governments-3800080","",""
"93","exp-capital transfers-general governments-3800080","",""
"94","exp-cap transfer-to households-general governments-3800080","",""
"95","exp-cap transfer-to non-profit institutions serving households-general governments-3800080","",""
"96","exp-cap transfer-to business-general governments-3800080","",""
"97","exp-cap transfer-to non-residents-general governments-3800080","",""
"98","exp-interest on debt-general governments-3800080","",""
"99","exp-general governments surplus or deficit-general governments-3800080","",""
"100","exp-plus: consumption of fixed capital-general governments-3800080","",""
"101","exp-less: non-financial capital acquisition-general governments-3800080","",""
"102","exp-fixed capital-general governments-3800080","",""
"103","exp-new capital-general governments-3800080","",""
"104","exp-existing capital-general governments-3800080","",""
"105","exp-inventories-general governments-3800080","",""
"106","exp-equals: net lending or net borrowing-general governments-3800080","",""
"107","rev-general governments revenue-federal general government-3800080","",""
"108","rev-taxes on incomes-federal general government-3800080","",""
"109","rev-tax-from households-federal general government-3800080","",""
"110","rev-income taxes-federal general government-3800080","",""
"111","rev-wealth transfer taxes-federal general government-3800080","",""
"112","rev-from corporations and government business enterprises-federal general government-3800080","",""
"113","rev-from non-residents (withholding taxes)-federal general government-3800080","",""
"114","rev-contributions to social insurance plans-federal general government-3800080","",""
"115","rev-of which: employer and employee contributions to employment insurance-federal general government-3800080","",""
"116","rev-taxes on production and imports-federal general government-3800080","",""
"117","rev-taxes on production-federal general government-3800080","",""
"118","rev-other federal taxes on production-federal general government-3800080","",""
"119","rev-taxes on products-federal general government-3800080","",""
"120","rev-custom import duties-federal general government-3800080","",""
"121","rev-excise duties-federal general government-3800080","",""
"122","rev-excise taxes-federal general government-3800080","",""
"123","rev-manufacturers' sales tax-federal general government-3800080","",""
"124","rev-gasoline and motive fuel taxes-federal general government-3800080","",""
"125","rev-oil export tax-federal general government-3800080","",""
"126","rev-natural gas and gas liquids tax-federal general government-3800080","",""
"127","rev-old age security fund levy-federal general government-3800080","",""
"128","rev-other excise taxes-federal general government-3800080","",""
"129","rev-goods and services tax (gst)-federal general government-3800080","",""
"130","rev-air travellers security charge-federal general government-3800080","",""
"131","rev-federal-provincial lottery agreement-federal general government-3800080","",""
"132","rev-parimutuel supervision-federal general government-3800080","",""
"133","rev-western grain stabilization levy-federal general government-3800080","",""
"134","rev-canadian ownership charge-federal general government-3800080","",""
"135","rev-petroleum compensation charge-federal general government-3800080","",""
"136","rev-other federal taxes on products-federal general government-3800080","",""
"137","rev-other current transfers from households-federal general government-3800080","",""
"138","rev-current transfers from non-profit institutions serving households-federal general government-3800080","",""
"139","rev-current transfers from general governments-federal general government-3800080","",""
"140","rev-from provincial and territorial general governments-federal general government-3800080","",""
"141","rev-from provincial administration-federal general government-3800080","",""
"142","rev-from provincial education-federal general government-3800080","",""
"143","rev-from provincial health and social services-federal general government-3800080","",""
"144","rev-from local general governments-federal general government-3800080","",""
"145","rev-from aboriginal general governments-federal general government-3800080","",""
"146","rev-other current transfers from non-residents-federal general government-3800080","",""
"147","rev-investment income-federal general government-3800080","",""
"148","rev-royalties-federal general government-3800080","",""
"149","rev-interest and other investment income-federal general government-3800080","",""
"150","rev-remitted profits of government business enterprises-federal general government-3800080","",""
"151","rev-sales of goods and services-federal general government-3800080","",""
"152","rev-capital transfers-federal general government-3800080","",""
"153","rev-cap transfer-from households-federal general government-3800080","",""
"154","rev-cap transfer-from non-profit institutions serving households-federal general government-3800080","",""
"155","rev-cap transfer-from business-federal general government-3800080","",""
"156","rev-cap transfer-from general governments-federal general government-3800080","",""
"157","rev-cap transfer-from provincial and territorial general governments-federal general government-3800080","",""
"158","rev-cap transfer-from provincial administration-federal general government-3800080","",""
"159","rev-cap transfer-from provincial education-federal general government-3800080","",""
"160","rev-cap transfer-from provincial health and social services-federal general government-3800080","",""
"161","rev-cap transfer-from local general governments-federal general government-3800080","",""
"162","rev-cap transfer-from aboriginal general governments-federal general government-3800080","",""
"163","rev-cap transfer-from non-residents-federal general government-3800080","",""
"164","exp-general governments expenditure-federal general government-3800080","",""
"165","exp-final expenditure on goods and services-federal general government-3800080","",""
"166","exp-non-defence-federal general government-3800080","",""
"167","exp-defence-federal general government-3800080","",""
"168","exp-current transfers to households-federal general government-3800080","",""
"169","exp-family and youth allowances-federal general government-3800080","",""
"170","exp-child tax benefit-federal general government-3800080","",""
"171","exp-universal childcare benefit-federal general government-3800080","",""
"172","exp-child tax credit-federal general government-3800080","",""
"173","exp-employment insurance benefits-federal general government-3800080","",""
"174","exp-old age security-federal general government-3800080","",""
"175","exp-goods and services tax credit-federal general government-3800080","",""
"176","exp-adult occupational training-federal general government-3800080","",""
"177","exp-research and scholarship grants-federal general government-3800080","",""
"178","exp-other federal transfers to households-federal general government-3800080","",""
"179","exp-current transfers to non-profit institutions serving households-federal general government-3800080","",""
"180","exp-subsidies-federal general government-3800080","",""
"181","exp-subsidies on products and imports-federal general government-3800080","",""
"182","exp-agriculture-federal general government-3800080","",""
"183","exp-non-agriculture-federal general government-3800080","",""
"184","exp-subsidies on production-federal general government-3800080","",""
"185","exp-subsidies on production-agriculture-federal general government-3800080","",""
"186","exp-subsidies on production-non-agriculture-federal general government-3800080","",""
"187","exp-current transfers to general governments-federal general government-3800080","",""
"188","exp-to provincial and territorial general governments-federal general government-3800080","",""
"189","exp-to provincial and territorial administration-federal general government-3800080","",""
"190","exp-taxation agreements-federal general government-3800080","",""
"191","exp-post-secondary education-federal general government-3800080","",""
"192","exp-hospital insurance-federal general government-3800080","",""
"193","exp-medicare-federal general government-3800080","",""
"194","exp-extended health care-federal general government-3800080","",""
"195","exp-canada assistance plan-federal general government-3800080","",""
"196","exp-canada health and social transfer-federal general government-3800080","",""
"197","exp-canada health transfer-federal general government-3800080","",""
"198","exp-canada social transfer-federal general government-3800080","",""
"199","exp-territorial governments-federal general government-3800080","",""
"200","exp-official languages-federal general government-3800080","",""
"201","exp-regional development-federal general government-3800080","",""
"202","exp-other transfers to provincial and territorial general governments-federal general government-3800080","",""
"203","exp-to provincial and territorial education-federal general government-3800080","",""
"204","exp-to local general governments-federal general government-3800080","",""
"205","exp-to aboriginal general governments-federal general government-3800080","",""
"206","exp-current transfers to non-residents-federal general government-3800080","",""
"207","exp-contributions and aid-federal general government-3800080","",""
"208","exp-pension benefits and other-federal general government-3800080","",""
"209","exp-capital transfers-federal general government-3800080","",""
"210","exp-cap transfer-to households-federal general government-3800080","",""
"211","exp-cap transfer-to non-profit institutions serving households-federal general government-3800080","",""
"212","exp-cap transfer-to business-federal general government-3800080","",""
"213","exp-cap transfer-to general governments-federal general government-3800080","",""
"214","exp-cap transfer-to provincial and territorial general governments-federal general government-3800080","",""
"215","exp-cap transfer-to provincial administration-federal general government-3800080","",""
"216","exp-cap transfer-to provincial education-federal general government-3800080","",""
"217","exp-cap transfer-to provincial health and social services-federal general government-3800080","",""
"218","exp-cap transfer-to local general governments-federal general government-3800080","",""
"219","exp-cap transfer-to aboriginal general governments-federal general government-3800080","",""
"220","exp-cap transfer-to non-residents-federal general government-3800080","",""
"221","exp-interest on debt-federal general government-3800080","",""
"222","exp-general governments surplus or deficit-federal general government-3800080","",""
"223","exp-plus: consumption of fixed capital-federal general government-3800080","",""
"224","exp-less: non-financial capital acquisition-federal general government-3800080","",""
"225","exp-fixed capital-federal general government-3800080","",""
"226","exp-new capital-federal general government-3800080","",""
"227","exp-existing capital-federal general government-3800080","",""
"228","exp-inventories-federal general government-3800080","",""
"229","exp-equals: net lending or net borrowing-federal general government-3800080","",""
"230","rev-general governments revenue-provincial and territorial general governments-3800080","",""
"231","rev-taxes on incomes-provincial and territorial general governments-3800080","",""
"232","rev-tax-from households-provincial and territorial general governments-3800080","",""
"233","rev-income taxes-provincial and territorial general governments-3800080","",""
"234","rev-wealth transfer taxes-provincial and territorial general governments-3800080","",""
"235","rev-from corporations and government business enterprises-provincial and territorial general governments-3800080","",""
"236","rev-contributions to social insurance plans-provincial and territorial general governments-3800080","",""
"237","rev-taxes on production and imports-provincial and territorial general governments-3800080","",""
"238","rev-taxes on production-provincial and territorial general governments-3800080","",""
"239","rev-taxes on products-provincial and territorial general governments-3800080","",""
"240","rev-other current transfers from households-provincial and territorial general governments-3800080","",""
"241","rev-current transfers from non-profit institutions serving households-provincial and territorial general governments-3800080","",""
"242","rev-current transfers from general governments-provincial and territorial general governments-3800080","",""
"243","rev-from federal general government-provincial and territorial general governments-3800080","",""
"244","rev-from local general governments-provincial and territorial general governments-3800080","",""
"245","rev-from aboriginal general governments-provincial and territorial general governments-3800080","",""
"246","rev-investment income-provincial and territorial general governments-3800080","",""
"247","rev-sales of goods and services-provincial and territorial general governments-3800080","",""
"248","rev-capital transfers-provincial and territorial general governments-3800080","",""
"249","rev-cap transfer-from households-provincial and territorial general governments-3800080","",""
"250","rev-cap transfer-from non-profit institutions serving households-provincial and territorial general governments-3800080","",""
"251","rev-cap transfer-from business-provincial and territorial general governments-3800080","",""
"252","rev-cap transfer-from general governments-provincial and territorial general governments-3800080","",""
"253","rev-cap transfer-from federal general government-provincial and territorial general governments-3800080","",""
"254","rev-cap transfer-from local general governments-provincial and territorial general governments-3800080","",""
"255","rev-cap transfer-from aboriginal general governments-provincial and territorial general governments-3800080","",""
"256","exp-general governments expenditure-provincial and territorial general governments-3800080","",""
"257","exp-final expenditure on goods and services-provincial and territorial general governments-3800080","",""
"258","exp-current transfers to households-provincial and territorial general governments-3800080","",""
"259","exp-current transfers to non-profit institutions serving households-provincial and territorial general governments-3800080","",""
"260","exp-subsidies-provincial and territorial general governments-3800080","",""
"261","exp-subsidies on products and imports-provincial and territorial general governments-3800080","",""
"262","exp-subsidies on production-provincial and territorial general governments-3800080","",""
"263","exp-current transfers to general governments-provincial and territorial general governments-3800080","",""
"264","exp-to federal general government-provincial and territorial general governments-3800080","",""
"265","exp-to local general governments-provincial and territorial general governments-3800080","",""
"266","exp-to aboriginal general governments-provincial and territorial general governments-3800080","",""
"267","exp-current transfers to non-residents-provincial and territorial general governments-3800080","",""
"268","exp-capital transfers-provincial and territorial general governments-3800080","",""
"269","exp-cap transfer-to households-provincial and territorial general governments-3800080","",""
"270","exp-cap transfer-to non-profit institutions serving households-provincial and territorial general governments-3800080","",""
"271","exp-cap transfer-to business-provincial and territorial general governments-3800080","",""
"272","exp-cap transfer-to general governments-provincial and territorial general governments-3800080","",""
"273","exp-cap transfer-to federal general government-provincial and territorial general governments-3800080","",""
"274","exp-cap transfer-to local general governments-provincial and territorial general governments-3800080","",""
"275","exp-cap transfer-to aboriginal general governments-provincial and territorial general governments-3800080","",""
"276","exp-cap transfer-to non-residents-provincial and territorial general governments-3800080","",""
"277","exp-interest on debt-provincial and territorial general governments-3800080","",""
"278","exp-general governments surplus or deficit-provincial and territorial general governments-3800080","",""
"279","exp-plus: consumption of fixed capital-provincial and territorial general governments-3800080","",""
"280","exp-less: non-financial capital acquisition-provincial and territorial general governments-3800080","",""
"281","exp-fixed capital-provincial and territorial general governments-3800080","",""
"282","exp-new capital-provincial and territorial general governments-3800080","",""
"283","exp-existing capital-provincial and territorial general governments-3800080","",""
"284","exp-equals: net lending or net borrowing-provincial and territorial general governments-3800080","",""
"285","rev-general governments revenue-local general governments-3800080","",""
"286","rev-taxes on production and imports-local general governments-3800080","",""
"287","rev-taxes on production-local general governments-3800080","",""
"288","rev-licences-local general governments-3800080","",""
"289","rev-real property taxes-local general governments-3800080","",""
"290","rev-business taxes-local general governments-3800080","",""
"291","rev-developers' fees-local general governments-3800080","",""
"292","rev-other local taxes on production-local general governments-3800080","",""
"293","rev-taxes on products-local general governments-3800080","",""
"294","rev-deed transfer tax-local general governments-3800080","",""
"295","rev-sales taxes-local general governments-3800080","",""
"296","rev-amusement taxes-local general governments-3800080","",""
"297","rev-other current transfers from households-local general governments-3800080","",""
"298","rev-current transfers from non-profit institutions serving households-local general governments-3800080","",""
"299","rev-current transfers from general governments-local general governments-3800080","",""
"300","rev-from federal general government-local general governments-3800080","",""
"301","rev-from provincial and territorial general governments-local general governments-3800080","",""
"302","rev-from provincial administration-local general governments-3800080","",""
"303","rev-from provincial education-local general governments-3800080","",""
"304","rev-from provincial health and social services-local general governments-3800080","",""
